{"case_id":"01ARZ3NDEKTSV4RRFFQ69G5FAV","contract_version":"1.0.0","discretion":[],"intent":{"amended_from":null,"text":"Reject empty input."},"ledger_head":"01ARZ3NDEKTSV4RRFFQ69G5FAY","obligations":[{"evidence":{"artifact_excerpt":"Return an empty result.","attack_id":"01ARZ3NDEKTSV4RRFFQ69G5FAW","choice":"A","hate_scenario":"Silent success hides an upstream failure.","klass":"boundary","ruling_id":"01ARZ3NDEKTSV4RRFFQ69G5FAX"},"kind":"forbidden","obligation_id":"01ARZ3NDEKTSV4RRFFQ69G5FAX","settles":["empty-input behavior","exit code"],"statement":"Forbid: Return an empty result.","verification":{"artifact_path":"cases/01ARZ3NDEKTSV4RRFFQ69G5FAV/derived/tests/test_empty_input.py","expressible":true,"reason":null,"renderer":"pytest","strength":"executable"}}],"open_ambiguities":[],"provenance":{"attacker_versions":{"boundary":"aaaaaaaaaaaaaaaaaaaaaaaaaaaaaaaaaaaaaaaaaaaaaaaaaaaaaaaaaaaaaaaa","conflict":"bbbbbbbbbbbbbbbbbbbbbbbbbbbbbbbbbbbbbbbbbbbbbbbbbbbbbbbbbbbbbbbb","consequence":"cccccccccccccccccccccccccccccccccccccccccccccccccccccccccccccccc","omission":"dddddddddddddddddddddddddddddddddddddddddddddddddddddddddddddddd","prototype":"eeeeeeeeeeeeeeeeeeeeeeeeeeeeeeeeeeeeeeeeeeeeeeeeeeeeeeeeeeeeeeee"},"deriver_version":"ffffffffffffffffffffffffffffffffffffffffffffffffffffffffffffffff","policy":{"max_rounds":2},"profile":{"digest":"9999999999999999999999999999999999999999999999999999999999999999","name":"coding"}}}
